{
	"Name": "Predator",
	"Stage": 0,
	"Tier": 0,
	"Variation": "Original",
	"Type": "SynergyBonus",
	"CombatClasses": {
		"Predator": 1
	},
	"Abilities": [
		{
			"Name": "Predator Imprint Stats",
			"ActivationTrigger": {
				"TriggerType": "OnBattleStart"
			},
			"TotalDurationMs": 0,
			"Skills": [
				{
					"Name": "Predator Imprint Stat List",
					"Deployment": {
						"Type": "Direct"
					},
					"Targeting": {
						"Type": "Self"
					},
					"EffectPackage": {
						"Effects": [
							{
								"Type": "Buff",
								"Stat": "AttackPhysicalDamage",
								"OverlapProcessType": "Stacking",
								"DurationMs": -1,
								"Expression": {
									"Percentage": 20,
									"Stat": "AttackPhysicalDamage",
									"StatSource": "Receiver",
									"StatEvaluationType": "Base"
								}
							},
							{
								"Type": "Buff",
								"Stat": "AttackEnergyDamage",
								"OverlapProcessType": "Stacking",
								"DurationMs": -1,
								"Expression": {
									"Percentage": 20,
									"Stat": "AttackEnergyDamage",
									"StatSource": "Receiver",
									"StatEvaluationType": "Base"
								}
							},
							{
								"Type": "Buff",
								"Stat": "AttackPureDamage",
								"OverlapProcessType": "Stacking",
								"DurationMs": -1,
								"Expression": {
									"Percentage": 20,
									"Stat": "AttackPureDamage",
									"StatSource": "Receiver",
									"StatEvaluationType": "Base"
								}
							}
						]
					}
				}
			]
		}
	],
	"DisplayName": "Predator Imprint",
	"DisplayDescription": "The holder gains the Predator Composite Class and 20% <AttackDamage>Attack Damage</>.",
	"Description": {
		"Format": "The holder gains the Predator Composite Class and 20% <AttackDamage>Attack Damage</>.",
		"Parameters": {}
	},
	"DisplayDescriptionNormalized": "The holder gains the Predator Composite Class and 20% Attack Damage."
}