{
	"Name": "RuinationPrism",
	"Stage": 0,
	"Tier": 0,
	"Variation": "Original",
	"Type": "GreaterPower",
	"Abilities": [
		{
			"Name": "RuinationPrism_Ability1",
			"ActivationTrigger": {
				"TriggerType": "OnBattleStart"
			},
			"TotalDurationMs": 0,
			"Skills": [
				{
					"Name": "Physical resist and grit debuff aura",
					"Deployment": {
						"Type": "Direct"
					},
					"Targeting": {
						"Type": "Self"
					},
					"EffectPackage": {
						"Effects": [
							{
								"Type": "Buff",
								"Stat": "AttackPhysicalDamage",
								"OverlapProcessType": "Stacking",
								"DurationMs": -1,
								"Expression": {
									"Percentage": 20,
									"Stat": "AttackPhysicalDamage",
									"StatSource": "Receiver"
								}
							},
							{
								"Type": "Buff",
								"Stat": "AttackEnergyDamage",
								"OverlapProcessType": "Stacking",
								"DurationMs": -1,
								"Expression": {
									"Percentage": 20,
									"Stat": "AttackEnergyDamage",
									"StatSource": "Receiver"
								}
							},
							{
								"Type": "Buff",
								"Stat": "AttackPureDamage",
								"OverlapProcessType": "Stacking",
								"DurationMs": -1,
								"Expression": {
									"Percentage": 20,
									"Stat": "AttackPureDamage",
									"StatSource": "Receiver"
								}
							},
							{
								"Type": "Buff",
								"Stat": "OmegaDamagePercentage",
								"OverlapProcessType": "Stacking",
								"DurationMs": -1,
								"Expression": {
									"Percentage": 20,
									"Stat": "OmegaDamagePercentage",
									"StatSource": "Receiver"
								}
							}
						]
					}
				}
			]
		},
		{
			"Name": "RuinationPrism_Ability2",
			"ActivationTrigger": {
				"TriggerType": "OnHit",
				"AbilityTypes": [
					"Attack"
				],
				"SenderAllegiance": "Self",
				"ReceiverAllegiance": "Enemy",
				"EveryX": true
			},
			"TotalDurationMs": 0,
			"Skills": [
				{
					"Name": "RuinationPrism - Self Buff",
					"Deployment": {
						"Type": "Direct"
					},
					"Targeting": {
						"Type": "Self"
					},
					"EffectPackage": {
						"Effects": [
							{
								"Type": "Buff",
								"Stat": "PhysicalResist",
								"OverlapProcessType": "Stacking",
								"DurationMs": -1,
								"Expression": {
									"Operation": "*",
									"Operands": [
										{
											"Percentage": 5,
											"Stat": "PhysicalResist",
											"StatSource": "SenderFocus"
										}
									]
								}
							},
							{
								"Type": "Buff",
								"Stat": "EnergyResist",
								"OverlapProcessType": "Stacking",
								"DurationMs": -1,
								"Expression": {
									"Operation": "*",
									"Operands": [
										{
											"Percentage": 5,
											"Stat": "EnergyResist",
											"StatSource": "SenderFocus"
										}
									]
								}
							}
						]
					}
				},
				{
					"Name": "RuinationPrism - Enemy Debuff",
					"Deployment": {
						"Type": "Direct"
					},
					"Targeting": {
						"Type": "CurrentFocus"
					},
					"EffectPackage": {
						"Effects": [
							{
								"Type": "Debuff",
								"Stat": "PhysicalResist",
								"OverlapProcessType": "Stacking",
								"DurationMs": -1,
								"Expression": {
									"Percentage": 5,
									"Stat": "PhysicalResist",
									"StatSource": "Receiver"
								}
							},
							{
								"Type": "Debuff",
								"Stat": "EnergyResist",
								"OverlapProcessType": "Stacking",
								"DurationMs": -1,
								"Expression": {
									"Percentage": 5,
									"Stat": "EnergyResist",
									"StatSource": "Receiver"
								}
							}
						]
					}
				}
			]
		}
	],
	"DisplayName": "Ruination Prism",
	"DisplayDescription": "Gain <DamageAmplification>20%</> <DamageAmplification>Damage Amp</>. Holder's attacks steal <Resistance>5%</> <Resistance>Resistances</> from the target.",
	"Description": {
		"Format": "Gain <DamageAmplification>{DmgAmp}%</> <DamageAmplification>Damage Amp</>. Holder's attacks steal <Resistance>{ResistSteal}%</> <Resistance>Resistances</> from the target.",
		"Parameters": {
			"DmgAmp": {
				"ParameterPath": "Abilities[0].Skills[0].EffectPackage.Effects[0].Expression.Percentage",
				"ValueMultiplier": 1.0
			},
			"ResistSteal": {
				"ParameterPath": "Abilities[1].Skills[0].EffectPackage.Effects[0].Expression.Operands[0].Percentage",
				"ValueMultiplier": 1.0
			}
		}
	},
	"DisplayDescriptionNormalized": "Gain 20% Damage Amp. Holder's attacks steal 5% Resistances from the target."
}